ENCAP1-SG-REI-19-365;REINICIO DE LOS PROCEDIMIENTOS DE SELECCIÓN EN LAS CONTRATACIONES DEL ESTADO EN EL MARCO DEL COVID-19;1;60 HORAS;Del 27 de diciembre del  2021 al 6 de enero del año 2022;;1
ENCAP1-SG-REIECT-366;REINICIO DE OBRAS PÚBLICAS CON EL SOFTWARE S10 Y MS PROJECT;1;60 HORAS;Del 27 de diciembre del  2021 al 6 de enero del año 2022;;1
ENCAP1-SG-REIENA-367;REINICIO DE OBRAS PÚBLICAS POST CUARENTENA;1;60 HORAS;Del 27 de diciembre del  2021 al 6 de enero del año 2022;;1
ENCAP1-SG-RESCAS-368;RESIDENCIA DE OBRAS PÚBLICAS;1;60 HORAS;Del 27 de diciembre del  2021 al 6 de enero del año 2022;;1
ENCAP1-SG-RESRAS-369;RESIDENCIA Y SUPERVISIÓN DE CARRETERAS;1;60 HORAS;Del 27 de diciembre del  2021 al 6 de enero del año 2022;;1
ENCAP1-SG-RESRAS-370;RESIDENCIA Y SUPERVISIÓN DE OBRAS;1;60 HORAS;Del 27 de diciembre del  2021 al 6 de enero del año 2022;;1
ENCAP1-SG-RESIAL-371;RESIDENCIA Y SUPERVISIÓN DE OBRAS DE INFRAESTRUCTURA VIAL;1;60 HORAS;Del 27 de diciembre del  2021 al 6 de enero del año 2022;;1
ENCAP1-SG-RESCAS-372;RESIDENCIA Y SUPERVISIÓN DE OBRAS PÚBLICAS;1;60 HORAS;Del 27 de diciembre del  2021 al 6 de enero del año 2022;;1
ENCAP1-SG-RESATA-373;RESIDENCIA Y SUPERVISIÓN EN OBRAS POR CONTRATA;1;60 HORAS;Del 27 de diciembre del  2021 al 6 de enero del año 2022;;1
ENCAP1-SG-RESCAS-374;RESIDENCIA, SUPERVISIÓN Y SEGURIDAD DE OBRAS PÚBLICAS;1;60 HORAS;Del 27 de diciembre del  2021 al 6 de enero del año 2022;;1
ENCAP1-SG-RESNES-375;RESIDENTE DE OBRAS EN EDIFICACIONES;1;60 HORAS;Del 27 de diciembre del  2021 al 6 de enero del año 2022;;1
ENCAP1-SG-RESCAS-376;RESPONSABILIDAD PENAL, CIVIL Y ADMINISTRATIVA POR INCUMPLIMIENTO DE PROTOCOLOS EN OBRAS PÚBLICAS;1;60 HORAS;Del 27 de diciembre del  2021 al 6 de enero del año 2022;;1
ENCAP1-SG-SALTAL-377;SALUD MENTAL;1;60 HORAS;Del 27 de diciembre del  2021 al 6 de enero del año 2022;;1
ENCAP1-SG-SALNAL-378;SALUD OCUPACIONAL;1;60 HORAS;Del 27 de diciembre del  2021 al 6 de enero del año 2022;;1
ENCAP1-SG-SALDAD-379;SALUD OCUPACIONAL Y BIOSEGURIDAD;1;60 HORAS;Del 27 de diciembre del  2021 al 6 de enero del año 2022;;1
ENCAP1-SG-SALCAS-380;SALUD OCUPACIONAL Y MEDIO AMBIENTE (SSOMA) EN OBRAS PÚBLICAS;1;60 HORAS;Del 27 de diciembre del  2021 al 6 de enero del año 2022;;1
ENCAP1-SG-SALLES-381;SALUD OCUPACIONAL Y RIESGOS LABORALES;1;60 HORAS;Del 27 de diciembre del  2021 al 6 de enero del año 2022;;1
ENCAP1-SG-SALTIL-382;SALUD Y NUTRICIÓN INFANTIL;1;60 HORAS;Del 27 de diciembre del  2021 al 6 de enero del año 2022;;1
ENCAP1-SG-SANNAS-383;SANEAMIENTO FÍSICO LEGAL DE PREDIOS RURALES Y COMUNIDADES CAMPESINAS;1;60 HORAS;Del 27 de diciembre del  2021 al 6 de enero del año 2022;;1
ENCAP1-SG-SANNOS-384;SANEAMIENTO FÍSICO LEGAL DE PREDIOS URBANOS;1;60 HORAS;Del 27 de diciembre del  2021 al 6 de enero del año 2022;;1
ENCAP1-SG-SANNIO-385;SANEAMIENTO POR PRESCRIPCIÓN ADQUISITIVA DE DOMINIO;1;60 HORAS;Del 27 de diciembre del  2021 al 6 de enero del año 2022;;1
ENCAP1-SG-SECCIA-386;SECRETARIADO EJECUTIVO Y ASISTENTE DE GERENCIA;1;60 HORAS;Del 27 de diciembre del  2021 al 6 de enero del año 2022;;1
ENCAP1-SG-SEGSBC-387;SEGURIDAD BASADA EN EL COMPORTAMIENTO SBC;1;60 HORAS;Del 27 de diciembre del  2021 al 6 de enero del año 2022;;1
ENCAP1-SG-SEGNES-388;SEGURIDAD EN EDIFICACIONES;1;60 HORAS;Del 27 de diciembre del  2021 al 6 de enero del año 2022;;1
ENCAP1-SG-SEGNTE-389;SEGURIDAD EN EL TRABAJO, HIGIENE OCUPACIONAL Y MEDIO AMBIENTE;1;60 HORAS;Del 27 de diciembre del  2021 al 6 de enero del año 2022;;1
ENCAP1-SG-SEGNTE-390;SEGURIDAD EN TRABAJO EN CALIENTE;1;60 HORAS;Del 27 de diciembre del  2021 al 6 de enero del año 2022;;1
ENCAP1-SG-SEGURA-391;SEGURIDAD EN TRABAJOS DE ALTURA;1;60 HORAS;Del 27 de diciembre del  2021 al 6 de enero del año 2022;;1
ENCAP1-SG-SEGCOS-392;SEGURIDAD EN TRABAJOS ELÉCTRICOS;1;60 HORAS;Del 27 de diciembre del  2021 al 6 de enero del año 2022;;1
ENCAP1-SG-SEGLES-393;SEGURIDAD Y PREVENCIÓN DE RIESGOS LABORALES;1;60 HORAS;Del 27 de diciembre del  2021 al 6 de enero del año 2022;;1
ENCAP1-SG-SEGCOS-394;SEGURIDAD Y PREVENCIÓN EN RIESGOS ELÉCTRICOS;1;60 HORAS;Del 27 de diciembre del  2021 al 6 de enero del año 2022;;1
ENCAP1-SG-SEGAJO-395;SEGURIDAD Y SALUD EN EL TRABAJO;1;60 HORAS;Del 27 de diciembre del  2021 al 6 de enero del año 2022;;1
ENCAP1-SG-SEGRAS-396;SEGURIDAD Y SALUD EN EL TRABAJO EN EL REINICIO DE OBRAS;1;60 HORAS;Del 27 de diciembre del  2021 al 6 de enero del año 2022;;1
ENCAP1-SG-SEGLES-397;SEGURIDAD Y SALUD EN EL TRABAJO EN OBRAS CIVILES;1;60 HORAS;Del 27 de diciembre del  2021 al 6 de enero del año 2022;;1
ENCAP1-SG-SEGIÓN-398;SEGURIDAD Y SALUD EN EL TRABAJO EN OBRAS DE CONSTRUCCIÓN;1;60 HORAS;Del 27 de diciembre del  2021 al 6 de enero del año 2022;;1
ENCAP1-SG-SEGIÓN-399;SEGURIDAD Y SALUD EN EL TRABAJO PARA EL SECTOR DE CONSTRUCCIÓN;1;60 HORAS;Del 27 de diciembre del  2021 al 6 de enero del año 2022;;1
ENCAP1-SG-SEGOMA-400;SEGURIDAD, SALUD OCUPACIONAL Y MEDIO AMBIENTE SSOMA;1;60 HORAS;Del 27 de diciembre del  2021 al 6 de enero del año 2022;;1
ENCAP1-SG-SEGMAC-401;SEGURIDAD, SALUD OCUPACIONAL, MEDIO AMBIENTE Y CALIDAD SSOMAC;1;60 HORAS;Del 27 de diciembre del  2021 al 6 de enero del año 2022;;1
ENCAP1-SG-SELCAS-402;SELECCIÓN DE PERSONAL EN LA GESTIÓN PÚBLICA BAJO LA MODALIDAD CAS;1;60 HORAS;Del 27 de diciembre del  2021 al 6 de enero del año 2022;;1
ENCAP1-SG-SERNAS-403;SERVICIOS AUXILIARES Y VENTILACIÓN DE MINAS;1;60 HORAS;Del 27 de diciembre del  2021 al 6 de enero del año 2022;;1
ENCAP1-SG-SIEGUA-404;SIEMBRA Y COSECHA DE AGUA;1;60 HORAS;Del 27 de diciembre del  2021 al 6 de enero del año 2022;;1
ENCAP1-SG-SIGRÍA-405;SIGA  TESORERÍA;1;60 HORAS;Del 27 de diciembre del  2021 al 6 de enero del año 2022;;1
ENCAP1-SG-SIGNES-406;SIGA LOGISTICO Y ALMACENES;1;60 HORAS;Del 27 de diciembre del  2021 al 6 de enero del año 2022;;1
ENCAP1-SG-SIGNIO-407;SIGA PATRIMONIO;1;60 HORAS;Del 27 de diciembre del  2021 al 6 de enero del año 2022;;1
ENCAP1-SG-SIGICO-408;SIGA: MÓDULO LOGÍSTICO;1;60 HORAS;Del 27 de diciembre del  2021 al 6 de enero del año 2022;;1
ENCAP1-SG-SISRNO-409;SISTEMA DE CONTROL INTERNO;1;60 HORAS;Del 27 de diciembre del  2021 al 6 de enero del año 2022;;1
ENCAP1-SG-SISFOH-410;SISTEMA DE FOCALIZACIÓN DE HOGARES - SISFOH;1;60 HORAS;Del 27 de diciembre del  2021 al 6 de enero del año 2022;;1
ENCAP1-SG-SISRTH-411;SISTEMA DE INFORMACIÓN GEOGRÁFICA CON ARCGIS Y GOOGLE EARTH;1;60 HORAS;Del 27 de diciembre del  2021 al 6 de enero del año 2022;;1
ENCAP1-SG-SISBIP-412;SISTEMA DE INFORMACIÓN NACIONAL DE BIENES ESTATALES SINABIP;1;60 HORAS;Del 27 de diciembre del  2021 al 6 de enero del año 2022;;1
ENCAP1-SG-SIS3.0-413;SISTEMA ELECTRÓNICO DE LAS CONTRATACIONES DEL ESTADO - SE@CE 3.0;1;60 HORAS;Del 27 de diciembre del  2021 al 6 de enero del año 2022;;1
ENCAP1-SG-SIS-SP-414;SISTEMA INTEGRADO DE ADMINISTRACIÓN FINANCIERA SIAF-SP;1;60 HORAS;Del 27 de diciembre del  2021 al 6 de enero del año 2022;;1
ENCAP1-SG-SISMEF-415;SISTEMA INTEGRADO DE GESTIÓN ADMINISTRATIVA SIGA-MEF;1;60 HORAS;Del 27 de diciembre del  2021 al 6 de enero del año 2022;;1
ENCAP1-SG-SISNTO-416;SISTEMA NACIONAL DE ABASTECIMIENTO;1;60 HORAS;Del 27 de diciembre del  2021 al 6 de enero del año 2022;;1
ENCAP1-SG-SUPNES-417;SUPERVISIÓN DE OBRAS EN EDIFICACIONES;1;60 HORAS;Del 27 de diciembre del  2021 al 6 de enero del año 2022;;1
ENCAP1-SG-SUPCAS-418;SUPERVISIÓN DE OBRAS PÚBLICAS;1;60 HORAS;Del 27 de diciembre del  2021 al 6 de enero del año 2022;;1
ENCAP1-SG-SUPRAS-419;SUPERVISIÓN DE OPERACIONES MINERAS;1;60 HORAS;Del 27 de diciembre del  2021 al 6 de enero del año 2022;;1
ENCAP1-SG-SUPCAS-420;SUPERVISIÓN EN INSTALACIONES ELÉCTRICAS;1;60 HORAS;Del 27 de diciembre del  2021 al 6 de enero del año 2022;;1
ENCAP1-SG-SUPRAS-421;SUPERVISIÓN Y FISCALIZACIÓN DE OBRAS;1;60 HORAS;Del 27 de diciembre del  2021 al 6 de enero del año 2022;;1
ENCAP1-SG-SUPTAL-422;SUPERVISIÓN Y FISCALIZACIÓN DEL ESTUDIO DE IMPACTO AMBIENTAL;1;60 HORAS;Del 27 de diciembre del  2021 al 6 de enero del año 2022;;1
ENCAP1-SG-SUPADO-423;SUPERVISIÓN, DISEÑO Y CONSTRUCCIÓN DE EDIFICIOS DE CONCRETO ARMADO;1;60 HORAS;Del 27 de diciembre del  2021 al 6 de enero del año 2022;;1
ENCAP1-SG-SUPBIM-424;SUPERVISOR DE PROYECTOS BIM;1;60 HORAS;Del 27 de diciembre del  2021 al 6 de enero del año 2022;;1
ENCAP1-SG-SUPNAL-425;SUPERVISOR DE SEGURIDAD Y SALUD OCUPACIONAL;1;60 HORAS;Del 27 de diciembre del  2021 al 6 de enero del año 2022;;1
ENCAP1-SG-SUPSGO-426;SUPERVISOR DE TRABAJOS DE ALTO RIESGO;1;60 HORAS;Del 27 de diciembre del  2021 al 6 de enero del año 2022;;1
ENCAP1-SG-SUPBRA-427;SUPERVISOR E INSPECTOR DE OBRA;1;60 HORAS;Del 27 de diciembre del  2021 al 6 de enero del año 2022;;1
ENCAP1-SG-SUPLES-428;SUPERVISOR EN SEGURIDAD INDUSTRIAL Y PREVENCIÓN DE RIESGOS LABORALES;1;60 HORAS;Del 27 de diciembre del  2021 al 6 de enero del año 2022;;1
ENCAP1-SG-SUPAJO-429;SUPERVISOR EN SEGURIDAD Y SALUD EN EL TRABAJO;1;60 HORAS;Del 27 de diciembre del  2021 al 6 de enero del año 2022;;1
ENCAP1-SG-SUPAJO-430;SUPERVISOR IMPLEMENTADOR DEL PLAN DE VIGILANCIA Y CONTROL DEL COVID-19 EN EL TRABAJO;1;60 HORAS;Del 27 de diciembre del  2021 al 6 de enero del año 2022;;1
ENCAP1-SG-SUPNTE-431;SUPERVISOR SSOMA SEGURIDAD, SALUD Y MEDIO AMBIENTE;1;60 HORAS;Del 27 de diciembre del  2021 al 6 de enero del año 2022;;1
ENCAP1-SG-SUPMAC-432;SUPERVISOR SSOMAC;1;60 HORAS;Del 27 de diciembre del  2021 al 6 de enero del año 2022;;1
ENCAP1-SG-TASLES-433;TASACIONES DE PREDIOS URBANOS Y RURALES;1;60 HORAS;Del 27 de diciembre del  2021 al 6 de enero del año 2022;;1
ENCAP1-SG-TÉCURA-434;TÉCNICAS DE TRABAJO Y RESCATE EN ALTURA;1;60 HORAS;Del 27 de diciembre del  2021 al 6 de enero del año 2022;;1
ENCAP1-SG-TÉCCAD-435;TÉCNICO EN AUTOCAD;1;60 HORAS;Del 27 de diciembre del  2021 al 6 de enero del año 2022;;1
ENCAP1-SG-TÉCCAS-436;TÉCNICO EN CONSTRUCCIÓN CIVIL EN OBRAS PÚBLICAS;1;60 HORAS;Del 27 de diciembre del  2021 al 6 de enero del año 2022;;1
ENCAP1-SG-TECTOS-437;TECNOLOGÍAS DE LAS EMULSIONES ASFÁLTICAS Y SUS APLICACIONES EN PAVIMENTOS;1;60 HORAS;Del 27 de diciembre del  2021 al 6 de enero del año 2022;;1
ENCAP1-SG-TER-19-438;TERAPIA FÍSICA POST COVID-19;1;60 HORAS;Del 27 de diciembre del  2021 al 6 de enero del año 2022;;1
ENCAP1-SG-TICUAL-439;TIC’S Y ESTRATEGIAS DE ENSEÑANZA PARA LA DOCENCIA EN EDUCACIÓN VIRTUAL;1;60 HORAS;Del 27 de diciembre del  2021 al 6 de enero del año 2022;;1
ENCAP1-SG-TOPRÍA-440;TOPOGRAFÍA APLICADA A PROYECTOS DE INGENIERÍA;1;60 HORAS;Del 27 de diciembre del  2021 al 6 de enero del año 2022;;1
ENCAP1-SG-TOP 3D-441;TOPOGRAFÍA Y OBRAS CIVILES CON AUTOCAD CIVIL 3D;1;60 HORAS;Del 27 de diciembre del  2021 al 6 de enero del año 2022;;1
ENCAP1-SG-TRA-19-442;TRABAJO REMOTO EN TIEMPOS DE COVID-19;1;60 HORAS;Del 27 de diciembre del  2021 al 6 de enero del año 2022;;1
ENCAP1-SG-TRADOS-443;TRABAJOS EN ESPACIOS CONFINADOS;1;60 HORAS;Del 27 de diciembre del  2021 al 6 de enero del año 2022;;1
ENCAP1-SG-TRÁVOS-444;TRÁMITE DOCUMENTARIO Y GESTIÓN DE ARCHIVOS;1;60 HORAS;Del 27 de diciembre del  2021 al 6 de enero del año 2022;;1
ENCAP1-SG-TRAPAL-445;TRANSFERENCIA DE GESTIÓN REGIONAL Y MUNICIPAL;1;60 HORAS;Del 27 de diciembre del  2021 al 6 de enero del año 2022;;1
ENCAP1-SG-TRIIÓN-446;TRIBUTACIÓN;1;60 HORAS;Del 27 de diciembre del  2021 al 6 de enero del año 2022;;1
ENCAP1-SG-USORAS-447;USO DE SUELOS NO CONVENCIONALES PARA PAVIMENTOS EN CARRETERAS;1;60 HORAS;Del 27 de diciembre del  2021 al 6 de enero del año 2022;;1
ENCAP1-SG-USOADA-448;USO DE SUELOS NO CONVENCIONALES PARA PAVIMENTOS EN CARRETERAS CON SUPERFICIE ASFÁLTICA DELGADA;1;60 HORAS;Del 27 de diciembre del  2021 al 6 de enero del año 2022;;1
ENCAP1-SG-USOCAS-449;USO E IMPLEMENTACIÓN DE CUADERNO DE OBRA DIGITAL EN OBRAS PÚBLICAS;1;60 HORAS;Del 27 de diciembre del  2021 al 6 de enero del año 2022;;1
ENCAP1-SG-VALRAS-450;VALORIZACIÓN DE OBRAS;1;60 HORAS;Del 27 de diciembre del  2021 al 6 de enero del año 2022;;1
ENCAP1-SG-VALRAS-451;VALORIZACIÓN Y LIQUIDACIÓN DE OBRAS;1;60 HORAS;Del 27 de diciembre del  2021 al 6 de enero del año 2022;;1
ENCAP1-SG-VALATA-452;VALORIZACIÓN Y LIQUIDACIÓN DE OBRAS POR CONTRATA;1;60 HORAS;Del 27 de diciembre del  2021 al 6 de enero del año 2022;;1
ENCAP1-SG-VALCAS-453;VALORIZACIÓN Y LIQUIDACIÓN DE OBRAS PÚBLICAS;1;60 HORAS;Del 27 de diciembre del  2021 al 6 de enero del año 2022;;1
ENCAP1-SG-VALCTA-454;VALORIZACIÓN Y LIQUIDACIÓN DE OBRAS PÚBLICAS POR ADMINISTRACIÓN DIRECTA;1;60 HORAS;Del 27 de diciembre del  2021 al 6 de enero del año 2022;;1
ENCAP1-SG-VALCEL-455;VALORIZACIÓN, LIQUIDACIONES Y RECEPCIÓN DE OBRAS CON EXCEL;1;60 HORAS;Del 27 de diciembre del  2021 al 6 de enero del año 2022;;1
ENCAP1-SG-VALCAS-456;VALORIZACIÓN, RECEPCIÓN Y LIQUIDACIÓN DE OBRAS PÚBLICAS;1;60 HORAS;Del 27 de diciembre del  2021 al 6 de enero del año 2022;;1
ENCAP1-SG-VERRAL-457;VERIFICADOR CATASTRAL Y REGISTRAL;1;60 HORAS;Del 27 de diciembre del  2021 al 6 de enero del año 2022;;1
ENCAP1-SG-VIOIAR-458;VIOLENCIA CONTRA LAS MUJERES Y LOS INTEGRANTES DEL GRUPO FAMILIAR;1;60 HORAS;Del 27 de diciembre del  2021 al 6 de enero del año 2022;;1
ENCAP1-SG-VIOLES-459;VIOLENCIA FAMILIAR, DE GÉNERO Y DELITOS SEXUALES;1;60 HORAS;Del 27 de diciembre del  2021 al 6 de enero del año 2022;;1
ENCAP2-SG-ABALES-460;ABASTECIMIENTO Y LOGÍSTICA EN GOBIERNOS LOCALES Y REGIONALES;2;120 HORAS;;;1
ENCAP2-SG-ADMICA-461;ADMINISTRACIÓN Y GESTIÓN PÚBLICA;2;120 HORAS;;;1
ENCAP2-SG-ANÁNES-462;ANÁLISIS Y DISEÑO DE CIMENTACIONES;2;120 HORAS;;;1
ENCAP2-SG-ARBICA-463;ARBITRAJE Y JUNTA DE RESOLUCIÓN DE DISPUTAS EN LA CONTRATACIÓN PÚBLICA;2;120 HORAS;;;1
ENCAP2-SG-ASIIVO-464;ASISTENTE ADMINISTRATIVO;2;120 HORAS;;;1
ENCAP2-SG-ASIICA-465;ASISTENTE ADMINISTRATIVO EN LA GESTIÓN PÚBLICA;2;120 HORAS;;;1
ENCAP2-SG-ASIBLE-466;ASISTENTE CONTABLE;2;120 HORAS;;;1
ENCAP2-SG-ASILAS-467;ASISTENTE DE PLANILLAS;2;120 HORAS;;;1
ENCAP2-SG-ASIRAS-468;ASISTENTE TÉCNICO EN OBRAS;2;120 HORAS;;;1
ENCAP2-SG-ATEDAS-469;ATENCIÓN AL CLIENTE EN LAS ENTIDADES PÚBLICAS Y PRIVADAS;2;120 HORAS;;;1
ENCAP2-SG-ATSRÍA-470;ATS, PETS, PETAR E IPERC EN MINERÍA;2;120 HORAS;;;1
ENCAP2-SG-BIMIÓN-471;BIM EN LA CONSTRUCCIÓN;2;120 HORAS;;;1
ENCAP2-SG-BIOAJO-472;BIOSEGURIDAD Y SISTEMA DE SEGURIDAD Y SALUD EN EL TRABAJO;2;120 HORAS;;;1
ENCAP2-SG-CATRAL-473;CATASTRO MUNICIPAL, REGIONAL, URBANO Y RURAL;2;120 HORAS;;;1
ENCAP2-SG-COAZGO-474;COACHING Y LIDERAZGO;2;120 HORAS;;;1
ENCAP2-SG-CONTAL-475;CONTROL GUBERNAMENTAL;2;120 HORAS;;;1
ENCAP2-SG-COSRAS-476;COSTOS Y PRESUPUESTOS EN CARRETERAS;2;120 HORAS;;;1
ENCAP2-SG-COSCAS-477;COSTOS Y PRESUPUESTOS EN OBRAS PÚBLICAS;2;120 HORAS;;;1
ENCAP2-SG-COSCAS-478;COSTOS, PRESUPUESTOS Y PROGRAMACIÓN DE OBRAS PÚBLICAS;2;120 HORAS;;;1
ENCAP2-SG-DERIVO-479;DERECHO ADMINISTRATIVO;2;120 HORAS;;;1
ENCAP2-SG-DERVIL-480;DERECHO CIVIL Y PROCESAL CIVIL;2;120 HORAS;;;1
ENCAP2-SG-DERRAL-481;DERECHO LABORAL;2;120 HORAS;;;1
ENCAP2-SG-DIRPMI-482;DIRECCIÓN DE PROYECTOS BAJO EL ENFOQUE DEL PMI;2;120 HORAS;;;1
ENCAP2-SG-DISNES-483;DISEÑO DE CONCRETO ARMADO EN EDIFICACIONES;2;120 HORAS;;;1
ENCAP2-SG-DISÓN -484;DISEÑO DE ESTRUCTURAS METÁLICAS Y DE CONSTRUCCIÓN ;2;120 HORAS;;;1
ENCAP2-SG-DISCAS-485;DISEÑO DE INSTALACIONES ELÉCTRICAS;2;120 HORAS;;;1
ENCAP2-SG-DISMEP-486;DISEÑO DE INSTALACIONES SANITARIAS CON REVIT MEP;2;120 HORAS;;;1
ENCAP2-SG-DISNTO-487;DISEÑO Y SUPERVISIÓN DE OBRAS DE AGUA POTABLE Y SANEAMIENTO;2;120 HORAS;;;1
ENCAP2-SG-DISLES-488;DISEÑO, GESTIÓN Y ELABORACIÓN DE EXPEDIENTES DE PROYECTOS DE AGUA POTABLE, SANEAMIENTO ALCANTARILLADO Y TRATAMIENTO DE AGUAS RESIDUALES;2;120 HORAS;;;1
ENCAP2-SG-EJECAS-489;EJECUCIÓN Y CONTROL DE OBRAS PÚBLICAS;2;120 HORAS;;;1
ENCAP2-SG-ELARAL-490;ELABORACIÓN DE EXPEDIENTES TÉCNICOS EN SANEAMIENTO URBANO Y RURAL;2;120 HORAS;;;1
ENCAP2-SG-ELALES-491;ELABORACIÓN DE EXPEDIENTES TÉCNICOS MUNICIPALES;2;120 HORAS;;;1
ENCAP2-SG-ELARAS-492;ELABORACIÓN DE EXPEDIENTES TECNICOS PARA OBRAS;2;120 HORAS;;;1
ENCAP2-SG-ELA.PE-493;ELABORACIÓN Y SUPERVISIÓN DE FICHAS TÉCNICAS, IOARRS, PERFILES EXPEDIENTES TÉCNICOS Y FORMATOS DE REGISTRO SEGÚN EL INVIERTE.PE;2;120 HORAS;;;1
ENCAP2-SG-EXCNAL-494;EXCEL PROFESIONAL;2;120 HORAS;;;1
ENCAP2-SG-EXPTSE-495;EXPEDIENTES TÉCNICOS DE SEGURIDAD EN OBRAS DE EDIFICACIÓN ITSE;2;120 HORAS;;;1
ENCAP2-SG-EXPRAS-496;EXPEDIENTES TÉCNICOS, VALORIZACIONES Y LIQUIDACIONES DE OBRAS;2;120 HORAS;;;1
ENCAP2-SG-EXPCEL-497;EXPERTO EN EXCEL;2;120 HORAS;;;1
ENCAP2-SG-FINZAS-498;FINANZAS;2;120 HORAS;;;1
ENCAP2-SG-GEORAS-499;GEOTÉCNIA E HIDRÁULICA EN CARRETERAS;2;120 HORAS;;;1
ENCAP2-SG-GESTAL-500;GESTIÓN AMBIENTAL, EVALUACIÓN Y ESTUDIOS DE IMPACTO AMBIENTAL;2;120 HORAS;;;1
ENCAP2-SG-GESLES-501;GESTIÓN DE GOBIERNOS LOCALES Y REGIONALES;2;120 HORAS;;;1
ENCAP2-SG-GESECT-502;GESTIÓN DE PROYECTOS CON MS PROJECT;2;120 HORAS;;;1
ENCAP2-SG-GES P6-503;GESTIÓN DE PROYECTOS DE CONSTRUCCIÓN CON PRIMAVERA P6;2;120 HORAS;;;1
ENCAP2-SG-GESRAS-504;GESTIÓN DE PROYECTOS VIALES, RESIDENCIA Y SUPERVISIÓN DE CARRETERAS;2;120 HORAS;;;1
ENCAP2-SG-GESVIL-505;GESTIÓN DE RECURSOS HUMANOS Y LA LEY DEL SERVICIO CIVIL;2;120 HORAS;;;1
ENCAP2-SG-GESDOS-506;GESTIÓN DE RESIDUOS SÓLIDOS;2;120 HORAS;;;1
ENCAP2-SG-GESTAL-507;GESTIÓN DE TESORERÍA GUBERNAMENTAL;2;120 HORAS;;;1
ENCAP2-SG-GESNAL-508;GESTIÓN DEL TALENTO HUMANO Y SELECCIÓN DE PERSONAL;2;120 HORAS;;;1
ENCAP2-SG-GESSOS-509;GESTIÓN POR PROCESOS;2;120 HORAS;;;1
ENCAP2-SG-GESICA-510;GESTIÓN POR PROCESOS EN LA GESTIÓN PÚBLICA;2;120 HORAS;;;1
ENCAP2-SG-GESICA-511;GESTIÓN PÚBLICA;2;120 HORAS;;;1
ENCAP2-SG-GESPAL-512;GESTIÓN PÚBLICA MUNICIPAL;2;120 HORAS;;;1
ENCAP2-SG-GESADO-513;GESTIÓN Y ADMINISTRACIÓN DE ALMACENES DEL ESTADO;2;120 HORAS;;;1
ENCAP2-SG-GESLES-514;GESTIÓN Y CONTROL DE BIENES PATRIMONIALES;2;120 HORAS;;;1
ENCAP2-SG-GESCAS-515;GESTIÓN Y EJECUCIÓN DE OBRAS PÚBLICAS;2;120 HORAS;;;1
ENCAP2-SG-GESLES-516;GESTIÓN Y MANEJO DE CONFLICTOS SOCIALES;2;120 HORAS;;;1
ENCAP2-SG-HEROTO-517;HERRAMIENTAS DIGITALES PARA EL TRABAJO REMOTO;2;120 HORAS;;;1
ENCAP2-SG-HIDNES-518;HIDRÁULICA FLUVIAL, DISEÑO DE DEFENSAS RIBEREÑAS Y GAVIONES;2;120 HORAS;;;1
ENCAP2-SG-IMPTAL-519;IMPACTO AMBIENTAL;2;120 HORAS;;;1
ENCAP2-SG-IMPOES-520;IMPLEMENTACIÓN DEL SISTEMA HACCP, BPM Y POES;2;120 HORAS;;;1
ENCAP2-SG-INGRAS-521;INGENIERÍA EN PAVIMENTOS Y CARRETERAS;2;120 HORAS;;;1
ENCAP2-SG-INGLÉS-522;INGLÉS;2;120 HORAS;;;1
ENCAP2-SG-INSNES-523;INSTALACIONES ELÉCTRICAS EN EDIFICACIONES;2;120 HORAS;;;1
ENCAP2-SG-INT001-524;INTERPRETACIÓN E IMPLEMENTACIÓN DE LA TRINORMA ISO 9001, ISO 14001 E ISO 45001;2;120 HORAS;;;1
ENCAP2-SG-ISO001-525;ISO 45001;2;120 HORAS;;;1
ENCAP2-SG-LEGRAL-526;LEGISLACIÓN LABORAL, SEGURIDAD Y SALUD EN EL TRABAJO Y FISCALIZACIÓN LABORAL;2;120 HORAS;;;1
ENCAP2-SG-LEYADO-527;LEY DE CONTRATACIONES DEL ESTADO;2;120 HORAS;;;1
ENCAP2-SG-LEYCAS-528;LEY DE CONTRATACIONES DEL ESTADO APLICADO A OBRAS PÚBLICAS;2;120 HORAS;;;1
ENCAP2-SG-LEYRAL-529;LEY DEL PROCEDIMIENTO ADMINISTRATIVO GENERAL;2;120 HORAS;;;1
ENCAP2-SG-LICNES-530;LICENCIA DE HABILITACIONES URBANAS Y EDIFICACIONES;2;120 HORAS;;;1
ENCAP2-SG-MAEVIL-531;MAESTRO DE OBRA EN LA CONSTRUCCIÓN CIVIL;2;120 HORAS;;;1
ENCAP2-SG-MAN-19-532;MANEJO DE PACIENTES COVID-19;2;120 HORAS;;;1
ENCAP2-SG-MANACE-533;MANEJO DE SISTEMAS INFORMÁTICOS GUBERNAMENTALES SIGA-SIAF-SEACE;2;120 HORAS;;;1
ENCAP2-SG-MANCIO-534;MANTENIMIENTO DE CARRETERA POR NIVELES DE SERVICIO;2;120 HORAS;;;1
ENCAP2-SG-MANRAS-535;MANTENIMIENTO Y REHABILITACIÓN DE CARRETERAS;2;120 HORAS;;;1
ENCAP2-SG-MECLOS-536;MECÁNICA DE SUELOS;2;120 HORAS;;;1
ENCAP2-SG-METNES-537;METRADOS EN EDIFICACIONES;2;120 HORAS;;;1
ENCAP2-SG-NUTLUD-538;NUTRICIÓN, DIETÉTICA Y SALUD;2;120 HORAS;;;1
ENCAP2-SG-OFIICA-539;OFIMÁTICA APLICADA A LA GESTIÓN PÚBLICA;2;120 HORAS;;;1
ENCAP2-SG-OFIIAL-540;OFIMÁTICA EMPRESARIAL;2;120 HORAS;;;1
ENCAP2-SG-OFINAL-541;OFIMÁTICA PROFESIONAL;2;120 HORAS;;;1
ENCAP2-SG-PLAICA-542;PLANEAMIENTO ESTRATÉGICO EN LA GESTIÓN PÚBLICA;2;120 HORAS;;;1
ENCAP2-SG-PLAICO-543;PLANEAMIENTO ESTRATÉGICO Y PRESUPUESTO PÚBLICO;2;120 HORAS;;;1
ENCAP2-SG-PRESCE-544;PREPARACIÓN PARA LA CERTIFICACIÓN OSCE;2;120 HORAS;;;1
ENCAP2-SG-PREFIL-545;PREPARACIÓN PARA LA SUNAFIL;2;120 HORAS;;;1
ENCAP2-SG-PREDOS-546;PRESUPUESTOS POR RESULTADOS;2;120 HORAS;;;1
ENCAP2-SG-PREIÓN-547;PREVENCIÓN DE RIESGOS EN OBRAS Y CONSTRUCCIÓN;2;120 HORAS;;;1
ENCAP2-SG-PRENAL-548;PREVENCIONISTA DE RIESGOS, SEGURIDAD Y SALUD OCUPACIONAL;2;120 HORAS;;;1
ENCAP2-SG-PRELES-549;PREVENCIONISTA EN SEGURIDAD, SALUD OCUPACIONAL Y PREVENCIÓN DE RIESGOS LABORALES;2;120 HORAS;;;1
ENCAP2-SG-PRIIOS-550;PRIMEROS AUXILIOS;2;120 HORAS;;;1
ENCAP2-SG-PROPAD-551;PROCEDIMIENTO ADMINISTRATIVO DISCIPLINARIO – PAD;2;120 HORAS;;;1
ENCAP2-SG-PROECT-552;PROGRAMACIÓN, CONTROL Y SEGUIMIENTO DE OBRAS CON S10 Y MS PROJECT;2;120 HORAS;;;1
ENCAP2-SG-PRO.PE-553;PROGRAMACIÓN, FORMULACIÓN Y GESTIÓN DE PROYECTOS DE INVERSIÓN PÚBLICA – INVIERTE.PE;2;120 HORAS;;;1
ENCAP2-SG-PROIÓN-554;PROGRAMACIÓN, METRADOS, COSTOS, PRESUPUESTOS Y VALORIZACIÓN;2;120 HORAS;;;1
ENCAP2-SG-QUEHUA-555;QUECHUA;2;120 HORAS;;;1
ENCAP2-SG-RECICA-556;RECURSOS HUMANOS Y EL NUEVO PERFIL EN LA GESTIÓN PÚBLICA;2;120 HORAS;;;1
ENCAP2-SG-REDICA-557;REDACCIÓN DE DOCUMENTOS EN LA GESTIÓN PÚBLICA;2;120 HORAS;;;1
ENCAP2-SG-REDADO-558;REDACCIÓN PROFESIONAL DE DOCUMENTOS ADMINISTRATIVOS PARA EL SECTOR PÚBLICO Y PRIVADO;2;120 HORAS;;;1
ENCAP2-SG-RESRAS-559;RESIDENCIA Y SUPERVISIÓN DE OBRAS;2;120 HORAS;;;1
ENCAP2-SG-RESRAS-560;RESIDENCIA, SUPERVISIÓN Y SEGURIDAD DE OBRAS;2;120 HORAS;;;1
ENCAP2-SG-RESCAS-561;RESIDENTE DE OBRAS PÚBLICAS;2;120 HORAS;;;1
ENCAP2-SG-SEA3.0-562;SEACE 3.0;2;120 HORAS;;;1
ENCAP2-SG-SECCIA-563;SECRETARIADO EJECUTIVO Y ASISTENTE DE GERENCIA;2;120 HORAS;;;1
ENCAP2-SG-SEGNTE-564;SEGURIDAD EN EL TRABAJO, HIGIENE OCUPACIONAL Y MEDIO AMBIENTE;2;120 HORAS;;;1
ENCAP2-SG-SEGAJO-565;SEGURIDAD Y SALUD EN EL TRABAJO;2;120 HORAS;;;1
ENCAP2-SG-SEGICO-566;SEGURIDAD Y SALUD EN EL TRABAJO EN EL SECTOR ELÉCTRICO;2;120 HORAS;;;1
ENCAP2-SG-SEGERO-567;SEGURIDAD Y SALUD EN EL TRABAJO EN EL SECTOR MINERO;2;120 HORAS;;;1
ENCAP2-SG-SEGRAS-568;SEGURIDAD Y SALUD EN EL TRABAJO EN OBRAS;2;120 HORAS;;;1
ENCAP2-SG-SEGLES-569;SEGURIDAD Y SALUD EN EL TRABAJO EN OBRAS CIVILES;2;120 HORAS;;;1
ENCAP2-SG-SEGOMA-570;SEGURIDAD, SALUD OCUPACIONAL Y MEDIO AMBIENTE SSOMA;2;120 HORAS;;;1
ENCAP2-SG-SIGICA-571;SIGA LOGÍSTICA;2;120 HORAS;;;1
ENCAP2-SG-SIGMEF-572;SIGA MEF;2;120 HORAS;;;1
ENCAP2-SG-SISRNO-573;SISTEMA DE CONTROL INTERNO;2;120 HORAS;;;1
ENCAP2-SG-SISRÍA-574;SISTEMA DE GESTIÓN DE SEGURIDAD Y SALUD EN EL TRABAJO EN MINERÍA;2;120 HORAS;;;1
ENCAP2-SG-SIS.PE-575;SISTEMA DE INVERSIÓN PÚBLICA INVIERTE.PE;2;120 HORAS;;;1
ENCAP2-SG-SISIAF-576;SISTEMA INTEGRADO DE ADMINISTRACIÓN FINANCIERA SIAF;2;120 HORAS;;;1
ENCAP2-SG-SISACE-577;SISTEMAS ADMINISTRATIVOS EN LA GESTIÓN PÚBLICA SIAF, SIGA Y SEACE;2;120 HORAS;;;1
ENCAP2-SG-SUPNES-578;SUPERVISIÓN DE OBRAS EN EDIFICACIONES;2;120 HORAS;;;1
ENCAP2-SG-SUPBRA-579;SUPERVISOR E INSPECTOR DE OBRA;2;120 HORAS;;;1
ENCAP2-SG-TRÁVOS-580;TRÁMITE DOCUMENTARIO Y GESTIÓN DE ARCHIVOS;2;120 HORAS;;;1
ENCAP2-SG-TRIIÓN-581;TRIBUTACIÓN;2;120 HORAS;;;1
ENCAP2-SG-VALRAS-582;VALORIZACION Y LIQUIDACION DE OBRAS;2;120 HORAS;;;1
ENCAP2-SG-VALCAS-583;VALORIZACIÓN Y LIQUIDACIÓN FINANCIERA DE OBRAS PÚBLICAS;2;120 HORAS;;;1
ENCAP2-SG-VALCAS-584;VALORIZACIÓN, ADELANTOS DIRECTOS, MATERIALES, MAYORES GASTOS GENERALES, REAJUSTE, DEDUCCIÓN, AMORTIZACIÓN Y LIQUIDACIÓN DE OBRAS PÚBLICAS;2;120 HORAS;;;1
ENCAP3-SG-ADMICA-585;ADMINISTRACIÓN Y GESTIÓN PÚBLICA;3;220 HORAS;;;1
ENCAP3-SG-ATEDAS-586;ATENCIÓN AL CLIENTE EN LAS ENTIDADES PÚBLICAS Y PRIVADAS;3;220 HORAS;;;1
ENCAP3-SG-COAZGO-587;COACHING Y LIDERAZGO;3;220 HORAS;;;1
ENCAP3-SG-CONADO-588;CONTRATACIONES DEL ESTADO;3;220 HORAS;;;1
ENCAP3-SG-DISNTO-589;DISEÑO Y SUPERVISIÓN DE OBRAS DE AGUA POTABLE Y SANEAMIENTO;3;220 HORAS;;;1
ENCAP3-SG-EXPRAS-590;EXPEDIENTES TÉCNICOS, VALORIZACIONES Y LIQUIDACIONES DE OBRAS;3;220 HORAS;;;1
ENCAP3-SG-EXPCEL-591;EXPERTO EN EXCEL;3;220 HORAS;;;1
ENCAP3-SG-GESTAL-592;GESTIÓN AMBIENTAL, EVALUACIÓN Y ESTUDIOS DE IMPACTO AMBIENTAL;3;220 HORAS;;;1
ENCAP3-SG-GESSOS-593;GESTIÓN POR PROCESOS;3;220 HORAS;;;1
ENCAP3-SG-GESICA-594;GESTIÓN PÚBLICA;3;220 HORAS;;;1
ENCAP3-SG-INFIAL-595;INFRAESTRUCTURA VIAL;3;220 HORAS;;;1
ENCAP3-SG-LEGRAL-596;LEGISLACIÓN LABORAL, SEGURIDAD Y SALUD EN EL TRABAJO Y FISCALIZACIÓN LABORAL;3;220 HORAS;;;1
ENCAP3-SG-RESCAS-597;RESIDENCIA, SUPERVISIÓN Y SEGURIDAD DE OBRAS PÚBLICAS;3;220 HORAS;;;1
ENCAP3-SG-SEGOMA-598;SEGURIDAD, SALUD OCUPACIONAL Y MEDIO AMBIENTE SSOMA;3;220 HORAS;;;1
